user_input,retrieved_contexts,response,reference,context_precision,context_recall,faithfulness,answer_relevancy
What was Apple’s revenue in Q1 2024?,[],"I'm sorry, but the retrieved documents do not contain information about Apple's revenue for Q1 2024. As of my last update, I do not have access to data beyond October 2023, and it seems the specific financial details for Q1 2024 have not been provided in the retrieved documents. For the most accurate and up-to-date financial information, I recommend checking Apple's official investor relations website or recent SEC filings such as their 10-K or 10-Q forms.",$119.58 billion,0.0,0.0,0.0,0.0
What earnings per share (EPS) did Apple report for the December quarter?,[],"I'm sorry, but the retrieved documents did not contain specific information regarding Apple's earnings per share (EPS) for the December quarter. To provide an accurate response, I would need access to the relevant earnings call transcript or financial report that includes this data. You may want to check Apple's official investor relations website or financial news outlets for the most recent and detailed earnings information. If you have access to additional documents or data, please provide them, and I will be happy to assist further.",$2.18,0.0,0.0,0.0,0.0
What was Apple’s net income for the December quarter?,[],"I'm sorry, but the retrieved documents did not provide specific information regarding Apple's net income for the December quarter. To provide an accurate response, I would need access to Apple's financial statements, such as their 10-K or 10-Q forms, which typically include detailed financial data including net income figures. If you have access to these documents, you can find the net income in the consolidated statements of operations section. Alternatively, you might consider checking Apple's investor relations website or financial news sources for the most recent quarterly earnings report.",$33.9 billion,0.0,0.0,0.0,0.0
What guidance did Apple give for company gross margin in the March quarter?,[],"Based on the retrieved information from the earnings calls, there is no specific guidance provided for Apple's gross margin in the March quarter. The documents do not contain detailed figures or projections related to the gross margin for that period. If you have access to additional sources or documents, they might provide the necessary details. Otherwise, it would be advisable to check Apple's official investor relations website or recent press releases for the most accurate and up-to-date information.",between 46% and 47%,0.0,0.0,0.0,0.0
"What were Apple’s total assets at September 28, 2024?",[],"I'm sorry, but the retrieved documents do not contain the specific information regarding Apple's total assets as of September 28, 2024. To provide an accurate answer, I would need access to Apple's financial statements or 10-K/10-Q filings for that period. If you have access to these documents, you can find the total assets figure in the balance sheet section. Alternatively, you may check Apple's investor relations website or financial databases for the most recent filings.",$364.98 billion,0.0,0.0,0.0,0.0
What dividend per share did Apple declare in fiscal year 2024?,[],"I'm sorry, but the retrieved documents do not contain specific information regarding the dividend per share that Apple declared in fiscal year 2024. To provide an accurate response, I would need access to Apple's official financial statements or press releases for that period. If you have access to Apple's 10-K or 10-Q forms for fiscal year 2024, those documents would typically include details about dividend declarations. Alternatively, you might find this information in Apple's investor relations announcements or financial news sources.",$0.98 per share or RSU,0.0,0.0,0.0,0.0
What was Apple’s net income for fiscal year 2024?,[],"I'm sorry, but the retrieved documents do not contain information about Apple's net income for fiscal year 2024. As of my last update, financial data for fiscal year 2024 would not be available until Apple releases its annual report or 10-K filing for that year. Typically, these documents are released shortly after the fiscal year ends, which for Apple is usually in late September. You may want to check Apple's investor relations website or financial news sources for the most recent updates.",$93.7 billion,0.0,0.0,0.0,0.0
What was Apple’s basic earnings per share for fiscal year 2024?,[],"I'm sorry, but the retrieved documents do not contain information about Apple's basic earnings per share for fiscal year 2024. To provide an accurate response, I would need access to Apple's financial statements or 10-K/10-Q filings for that fiscal year. If you have access to these documents, you can find the basic earnings per share in the income statement section. Alternatively, you might consider checking Apple's investor relations website or financial news sources for the most recent updates.",$6.11,0.0,0.0,0.0,0.0
What was Apple’s diluted earnings per share for fiscal year 2024?,[],"I'm sorry, but the retrieved documents do not contain information about Apple's diluted earnings per share for fiscal year 2024. It is possible that the data for fiscal year 2024 has not been released yet or was not included in the documents provided. For the most accurate and up-to-date financial information, I recommend checking Apple's official investor relations website or their latest SEC filings, such as the 10-K or 10-Q forms, once they are available.",$6.08,0.0,0.0,0.0,0.0
How much did Apple spend on repurchasing its common stock in fiscal year 2024?,[],"I'm sorry, but the retrieved documents do not contain specific information regarding Apple's expenditure on repurchasing its common stock in fiscal year 2024. To provide an accurate response, I would need access to the relevant sections of Apple's 10-K or 10-Q forms for fiscal year 2024, which would typically include details on stock repurchase activities. If you have access to these documents, you might want to check the ""Share Repurchase Program"" section or similar areas where such financial activities are usually reported. If you need further assistance, please provide more details or access to the specific documents.",$95.8 billion,0.0,0.0,0.0,0.0
